09:23:12.107410 IP belerofonte.50718 > gru06s35-in-f14.1e100.net.https: Flags [P.], seq 923408150:923408384, ack 2276912504, win 317, options [nop,nop,TS val 2125951370 ecr 2350042163], length 234
09:23:12.228589 IP gru06s35-in-f14.1e100.net.https > belerofonte.50718: Flags [.], ack 234, win 248, options [nop,nop,TS val 2350096348 ecr 2125951370], length 0
09:23:12.229553 IP gru06s35-in-f14.1e100.net.https > belerofonte.50718: Flags [P.], seq 1:303, ack 234, win 248, options [nop,nop,TS val 2350096348 ecr 2125951370], length 302
09:23:12.229568 IP belerofonte.50718 > gru06s35-in-f14.1e100.net.https: Flags [.], ack 303, win 339, options [nop,nop,TS val 2125951493 ecr 2350096348], length 0
09:23:12.230821 IP gru06s35-in-f14.1e100.net.https > belerofonte.50718: Flags [P.], seq 303:1721, ack 234, win 248, options [nop,nop,TS val 2350096348 ecr 2125951370], length 1418
09:23:12.230836 IP belerofonte.50718 > gru06s35-in-f14.1e100.net.https: Flags [.], ack 1721, win 362, options [nop,nop,TS val 2125951494 ecr 2350096348], length 0
09:23:12.235112 IP gru06s35-in-f14.1e100.net.https > belerofonte.50718: Flags [P.], seq 1721:3139, ack 234, win 248, options [nop,nop,TS val 2350096348 ecr 2125951370], length 1418
09:23:12.235131 IP belerofonte.50718 > gru06s35-in-f14.1e100.net.https: Flags [.], ack 3139, win 385, options [nop,nop,TS val 2125951498 ecr 2350096348], length 0
09:23:12.239364 IP gru06s35-in-f14.1e100.net.https > belerofonte.50718: Flags [P.], seq 3139:5975, ack 234, win 248, options [nop,nop,TS val 2350096348 ecr 2125951370], length 2836
09:23:12.239384 IP belerofonte.50718 > gru06s35-in-f14.1e100.net.https: Flags [.], ack 5975, win 429, options [nop,nop,TS val 2125951502 ecr 2350096348], length 0
09:23:12.247646 IP gru06s35-in-f14.1e100.net.https > belerofonte.50718: Flags [.], seq 5975:8811, ack 234, win 248, options [nop,nop,TS val 2350096349 ecr 2125951370], length 2836
09:23:12.247665 IP belerofonte.50718 > gru06s35-in-f14.1e100.net.https: Flags [.], ack 8811, win 473, options [nop,nop,TS val 2125951511 ecr 2350096349], length 0
09:23:12.255929 IP gru06s35-in-f14.1e100.net.https > belerofonte.50718: Flags [.], seq 8811:11647, ack 234, win 248, options [nop,nop,TS val 2350096358 ecr 2125951370], length 2836
09:23:12.255945 IP belerofonte.50718 > gru06s35-in-f14.1e100.net.https: Flags [.], ack 11647, win 518, options [nop,nop,TS val 2125951519 ecr 2350096358], length 0
09:23:12.264259 IP gru06s35-in-f14.1e100.net.https > belerofonte.50718: Flags [.], seq 11647:14483, ack 234, win 248, options [nop,nop,TS val 2350096366 ecr 2125951370], length 2836
09:23:12.264281 IP belerofonte.50718 > gru06s35-in-f14.1e100.net.https: Flags [.], ack 14483, win 562, options [nop,nop,TS val 2125951527 ecr 2350096366], length 0
09:23:12.272566 IP gru06s35-in-f14.1e100.net.https > belerofonte.50718: Flags [.], seq 14483:17319, ack 234, win 248, options [nop,nop,TS val 2350096375 ecr 2125951370], length 2836
09:23:12.272588 IP belerofonte.50718 > gru06s35-in-f14.1e100.net.https: Flags [.], ack 17319, win 606, options [nop,nop,TS val 2125951536 ecr 2350096375], length 0
09:23:12.280841 IP gru06s35-in-f14.1e100.net.https > belerofonte.50718: Flags [.], seq 17319:20155, ack 234, win 248, options [nop,nop,TS val 2350096383 ecr 2125951370], length 2836
09:23:12.280854 IP belerofonte.50718 > gru06s35-in-f14.1e100.net.https: Flags [.], ack 20155, win 651, options [nop,nop,TS val 2125951544 ecr 2350096383], length 0
09:23:12.288900 IP gru06s35-in-f14.1e100.net.https > belerofonte.50718: Flags [P.], seq 20155:20249, ack 234, win 248, options [nop,nop,TS val 2350096399 ecr 2125951370], length 94
09:23:12.288918 IP belerofonte.50718 > gru06s35-in-f14.1e100.net.https: Flags [.], ack 20249, win 651, options [nop,nop,TS val 2125951552 ecr 2350096399], length 0
09:23:12.289128 IP belerofonte.50718 > gru06s35-in-f14.1e100.net.https: Flags [P.], seq 234:280, ack 20249, win 651, options [nop,nop,TS val 2125951552 ecr 2350096399], length 46
09:23:12.449900 IP gru06s35-in-f14.1e100.net.https > belerofonte.50718: Flags [.], ack 280, win 248, options [nop,nop,TS val 2350096569 ecr 2125951552], length 0

